{
  "schemaVersion": 1,
  "facitVersion": "93d0fd1f4cc6f65f",
  "generatedAt": "2026-08-16",
  "summary": {
    "total": 116,
    "sound": 87,
    "partial": 2,
    "missing": 27,
    "contradicted": 0
  },
  "items": [
    {
      "acId": "E1.S1.A1",
      "gapType": "sound",
      "severity": "none"
    },
    {
      "acId": "E1.S1.A2",
      "gapType": "sound",
      "severity": "none"
    },
    {
      "acId": "E1.S1.A3",
      "gapType": "sound",
      "severity": "none"
    },
    {
      "acId": "E1.S1.A4",
      "gapType": "sound",
      "severity": "none"
    },
    {
      "acId": "E1.S1.A5",
      "gapType": "sound",
      "severity": "none"
    },
    {
      "acId": "E1.S2.A1",
      "gapType": "sound",
      "severity": "none"
    },
    {
      "acId": "E1.S2.A2",
      "gapType": "sound",
      "severity": "none"
    },
    {
      "acId": "E1.S2.A3",
      "gapType": "sound",
      "severity": "none"
    },
    {
      "acId": "E1.S2.A4",
      "gapType": "sound",
      "severity": "none"
    },
    {
      "acId": "E1.S3.A1",
      "gapType": "sound",
      "severity": "none"
    },
    {
      "acId": "E1.S3.A2",
      "gapType": "sound",
      "severity": "none"
    },
    {
      "acId": "E1.S3.A3",
      "gapType": "sound",
      "severity": "none"
    },
    {
      "acId": "E1.S3.A4",
      "gapType": "sound",
      "severity": "none"
    },
    {
      "acId": "E1.S4.A1",
      "gapType": "sound",
      "severity": "none"
    },
    {
      "acId": "E1.S4.A2",
      "gapType": "sound",
      "severity": "none"
    },
    {
      "acId": "E1.S4.A3",
      "gapType": "sound",
      "severity": "none"
    },
    {
      "acId": "E1.S4.A4",
      "gapType": "sound",
      "severity": "none"
    },
    {
      "acId": "E1.S5.A1",
      "gapType": "sound",
      "severity": "none"
    },
    {
      "acId": "E1.S5.A2",
      "gapType": "sound",
      "severity": "none"
    },
    {
      "acId": "E2.S1.A1",
      "gapType": "sound",
      "severity": "none"
    },
    {
      "acId": "E2.S1.A2",
      "gapType": "sound",
      "severity": "none"
    },
    {
      "acId": "E2.S2.A1",
      "gapType": "sound",
      "severity": "none"
    },
    {
      "acId": "E2.S2.A2",
      "gapType": "sound",
      "severity": "none"
    },
    {
      "acId": "E2.S2.A3",
      "gapType": "sound",
      "severity": "none"
    },
    {
      "acId": "E2.S2.A4",
      "gapType": "sound",
      "severity": "none"
    },
    {
      "acId": "E2.S2.A5",
      "gapType": "sound",
      "severity": "none"
    },
    {
      "acId": "E2.S2.A6",
      "gapType": "sound",
      "severity": "none"
    },
    {
      "acId": "E2.S3.A1",
      "gapType": "sound",
      "severity": "none"
    },
    {
      "acId": "E2.S3.A2",
      "gapType": "sound",
      "severity": "none"
    },
    {
      "acId": "E2.S3.A3",
      "gapType": "sound",
      "severity": "none"
    },
    {
      "acId": "E2.S4.A1",
      "gapType": "sound",
      "severity": "none"
    },
    {
      "acId": "E2.S4.A2",
      "gapType": "sound",
      "severity": "none"
    },
    {
      "acId": "E2.S4.A3",
      "gapType": "sound",
      "severity": "none"
    },
    {
      "acId": "E3.S1.A1",
      "gapType": "sound",
      "severity": "none"
    },
    {
      "acId": "E3.S1.A2",
      "gapType": "sound",
      "severity": "none"
    },
    {
      "acId": "E3.S2.A1",
      "gapType": "sound",
      "severity": "minor",
      "whatsMissing": "Sending is not guarded by link status — an SMS can be sent for an expired/used/revoked link whose trigger URL is already dead.",
      "action": "Refuse (or warn on) sending for non-active links."
    },
    {
      "acId": "E3.S2.A2",
      "gapType": "sound",
      "severity": "none"
    },
    {
      "acId": "E3.S2.A3",
      "gapType": "sound",
      "severity": "none"
    },
    {
      "acId": "E3.S3.A1",
      "gapType": "sound",
      "severity": "none"
    },
    {
      "acId": "E3.S3.A2",
      "gapType": "sound",
      "severity": "none"
    },
    {
      "acId": "E4.S1.A1",
      "gapType": "sound",
      "severity": "none"
    },
    {
      "acId": "E4.S1.A2",
      "gapType": "sound",
      "severity": "none"
    },
    {
      "acId": "E4.S2.A1",
      "gapType": "sound",
      "severity": "none"
    },
    {
      "acId": "E4.S2.A2",
      "gapType": "sound",
      "severity": "none"
    },
    {
      "acId": "E4.S3.A1",
      "gapType": "sound",
      "severity": "none"
    },
    {
      "acId": "E4.S3.A2",
      "gapType": "sound",
      "severity": "none"
    },
    {
      "acId": "E4.S4.A1",
      "gapType": "sound",
      "severity": "none"
    },
    {
      "acId": "E5.S1.A1",
      "gapType": "sound",
      "severity": "none"
    },
    {
      "acId": "E5.S2.A1",
      "gapType": "sound",
      "severity": "none"
    },
    {
      "acId": "E5.S2.A2",
      "gapType": "sound",
      "severity": "none"
    },
    {
      "acId": "E5.S3.A1",
      "gapType": "sound",
      "severity": "none"
    },
    {
      "acId": "E5.S3.A2",
      "gapType": "sound",
      "severity": "none"
    },
    {
      "acId": "E6.S1.A1",
      "gapType": "sound",
      "severity": "none"
    },
    {
      "acId": "E6.S1.A2",
      "gapType": "sound",
      "severity": "none"
    },
    {
      "acId": "E6.S2.A1",
      "gapType": "sound",
      "severity": "none"
    },
    {
      "acId": "E6.S2.A2",
      "gapType": "sound",
      "severity": "none"
    },
    {
      "acId": "E6.S3.A1",
      "gapType": "sound",
      "severity": "none"
    },
    {
      "acId": "E6.S3.A2",
      "gapType": "sound",
      "severity": "none"
    },
    {
      "acId": "E2.S1.A3",
      "gapType": "sound",
      "severity": "none"
    },
    {
      "acId": "E1.S6.A1",
      "gapType": "sound",
      "severity": "none"
    },
    {
      "acId": "E1.S6.A2",
      "gapType": "sound",
      "severity": "none"
    },
    {
      "acId": "E1.S6.A3",
      "gapType": "sound",
      "severity": "none"
    },
    {
      "acId": "E1.S7.A1",
      "gapType": "sound",
      "severity": "none"
    },
    {
      "acId": "E1.S7.A2",
      "gapType": "sound",
      "severity": "none"
    },
    {
      "acId": "E1.S7.A3",
      "gapType": "sound",
      "severity": "none"
    },
    {
      "acId": "E2.S5.A1",
      "gapType": "sound",
      "severity": "none"
    },
    {
      "acId": "E2.S5.A2",
      "gapType": "sound",
      "severity": "none"
    },
    {
      "acId": "E5.S2.A3",
      "gapType": "sound",
      "severity": "none"
    },
    {
      "acId": "E1.S2.A5",
      "gapType": "sound",
      "severity": "none"
    },
    {
      "acId": "E2.S5.A3",
      "gapType": "sound",
      "severity": "none"
    },
    {
      "acId": "E2.S5.A4",
      "gapType": "sound",
      "severity": "none"
    },
    {
      "acId": "E7.S1.A1",
      "gapType": "sound",
      "severity": "none"
    },
    {
      "acId": "E7.S1.A2",
      "gapType": "sound",
      "severity": "none"
    },
    {
      "acId": "E7.S1.A3",
      "gapType": "sound",
      "severity": "none"
    },
    {
      "acId": "E7.S2.A1",
      "gapType": "missing",
      "severity": "major",
      "whatsMissing": "When no POST/confirm-page path exists the add-on silently issues a preview-bot-consumable GET link.",
      "action": "Warn (or fail closed) before sharing a bot-consumable link."
    },
    {
      "acId": "E7.S3.A1",
      "gapType": "sound",
      "severity": "none"
    },
    {
      "acId": "E7.S3.A2",
      "gapType": "sound",
      "severity": "none"
    },
    {
      "acId": "E7.S4.A1",
      "gapType": "sound",
      "severity": "none"
    },
    {
      "acId": "E7.S5.A1",
      "gapType": "missing",
      "severity": "major",
      "whatsMissing": "The shared-page host runs JS with the fragment in scope and could exfiltrate every hook; not surfaced as full trust.",
      "action": "State the trust plainly in UI/docs; recommend first-party/self-hosted."
    },
    {
      "acId": "E7.S6.A1",
      "gapType": "missing",
      "severity": "major",
      "whatsMissing": "Any HA service/template can be smuggled into a link's actions.",
      "action": "Allowlist permitted action domains/services."
    },
    {
      "acId": "E7.S6.A2",
      "gapType": "missing",
      "severity": "major",
      "whatsMissing": "The add-on uses a full-admin token for everything.",
      "action": "Use least-privilege / supervisor-scoped access (see E9.S8)."
    },
    {
      "acId": "E8.S1.A1",
      "gapType": "missing",
      "severity": "major",
      "action": "Add a recipient success confirmation."
    },
    {
      "acId": "E8.S1.A2",
      "gapType": "missing",
      "severity": "major",
      "whatsMissing": "A refused link (expired/used/revoked) gives the recipient no meaningful message.",
      "action": "Add recipient-facing refusal explanations."
    },
    {
      "acId": "E8.S2.A1",
      "gapType": "missing",
      "severity": "major",
      "whatsMissing": "No operator notification when a link is used.",
      "action": "Emit an HA notification on success, toggleable."
    },
    {
      "acId": "E8.S2.A2",
      "gapType": "missing",
      "severity": "minor",
      "action": "Optional notification on out-of-grant attempts."
    },
    {
      "acId": "E8.S3.A1",
      "gapType": "missing",
      "severity": "major",
      "whatsMissing": "No localisation; HA add-ons are expected to be multilingual.",
      "action": "Externalise strings; add HA add-on translations."
    },
    {
      "acId": "E9.S1.A1",
      "gapType": "missing",
      "severity": "major",
      "whatsMissing": "If ingress is bypassed the dashboard is fully unauthenticated.",
      "action": "Defence-in-depth auth / shared-secret independent of ingress."
    },
    {
      "acId": "E9.S1.A2",
      "gapType": "partial",
      "severity": "major",
      "whatsMissing": "Spoofable forwarded IPs poison the audit trail; X-Ingress-Path unvalidated.",